URL,Version,Status,OIDs,Name,Title,Descriptino,Uses,Used,Sources
http://fhir.de/ValueSet/bfarm/alpha-id,1.4.0,active,,AlphaId,null,"Die Alpha-ID ermöglicht es, medizinische und alltagssprachliche Diagnosenbezeichnungen zu kodieren, stellt also Diagnosenkodes zur Verfügung. 2005 als Prototyp vom DIMDI herausgegeben basiert die Alpha-ID auf dem Alphabetischen Verzeichnis zur ICD-10-GM. Jedem Eintrag des Alphabets ist eine fortlaufende, stabile, nichtsprechende Identifikationsnummer zugeordnet: der Alpha-ID-Kode. Er identifiziert den Eintrag eindeutig und übernimmt somit die Funktion eines nichtklassifizierenden Diagnosenkodes.","StructureDefinition/tumor-disorder","de.basisprofil.r4"
http://fhir.de/ValueSet/bfarm/atc,1.4.0,active,,ATC,null,"Anatomisch-therapeutisch-chemische Klassifkation (ATC) mit Tagesdosen deutsche Fassung","StructureDefinition/medication-statement,StructureDefinition/medication-administration","de.basisprofil.r4"
http://hl7.org/fhir/ValueSet/additional-instruction-codes,4.0.1,draft,"2.16.840.1.113883.4.642.3.95",SNOMEDCTAdditionalDosageInstructions,SNOMED CT Additional Dosage Instructions,"This value set includes all SNOMED CT Additional Dosage Instructions.","StructureDefinition/medication-statement","SCT"
http://hl7.org/fhir/ValueSet/administration-method-codes,4.0.1,draft,"2.16.840.1.113883.4.642.3.97",SNOMEDCTAdministrationMethodCodes,SNOMED CT Administration Method Codes,"This value set includes some method codes from SNOMED CT - provided as an exemplar","StructureDefinition/medication-statement,StructureDefinition/medication-administration","SCT"
http://hl7.org/fhir/ValueSet/approach-site-codes,4.0.1,draft,"2.16.840.1.113883.4.642.3.346",SNOMEDCTAnatomicalStructureForAdministrationSiteCodes,SNOMED CT Anatomical Structure for Administration Site Codes,"This value set includes Anatomical Structure codes from SNOMED CT - provided as an exemplar.","StructureDefinition/medication-statement,StructureDefinition/medication-administration","SCT"
http://hl7.org/fhir/ValueSet/body-site,4.0.1,draft,"2.16.840.1.113883.4.642.3.141",SNOMEDCTBodyStructures,SNOMED CT Body Structures,"This value set includes all codes from [SNOMED CT](http://snomed.info/sct) where concept is-a 442083009 (Anatomical or acquired body site (body structure)).","StructureDefinition/body-structure-base,StructureDefinition/karnofsky-performance-status,StructureDefinition/recist-category-observation,StructureDefinition/histology-topography,StructureDefinition/uicc-tnm,StructureDefinition/tumor,StructureDefinition/radiological-read-procedure,StructureDefinition/body-weight,StructureDefinition/recist-assessment-response,StructureDefinition/tumor-measurement,StructureDefinition/histopathological-grading-who,StructureDefinition/tumor-specimen,StructureDefinition/tnm-category-observation,StructureDefinition/radiological-tnm-read-procedure,StructureDefinition/tumor-disorder,StructureDefinition/ecog-performance-status,StructureDefinition/body-height,StructureDefinition/uicc-tnm-r-classification,StructureDefinition/vital-signs-base,StructureDefinition/radiological-recist-read-procedure","SCT"
http://hl7.org/fhir/ValueSet/bodystructure-code,4.0.1,draft,"2.16.840.1.113883.4.642.3.142",SNOMEDCTMorphologicAbnormalities,SNOMED CT Morphologic Abnormalities,"This value set includes all codes from [SNOMED CT](http://snomed.info/sct) where concept is-a 442083009 (Anatomical or acquired body site (body structure)).","StructureDefinition/body-structure-base,StructureDefinition/tumor","SCT"
http://hl7.org/fhir/ValueSet/bodystructure-relative-location,4.0.1,draft,"2.16.840.1.113883.4.642.3.140",BodystructureLocationQualifier,Bodystructure Location Qualifier,"SNOMED-CT concepts modifying the anatomic location","StructureDefinition/body-structure-base,StructureDefinition/tumor","SCT"
http://hl7.org/fhir/ValueSet/clinical-findings,4.0.1,draft,"2.16.840.1.113883.4.642.3.232",SNOMEDCTClinicalFindings,SNOMED CT Clinical Findings,"This value set includes all the ""Clinical finding"" [SNOMED CT](http://snomed.info/sct) codes - concepts where concept is-a 404684003 (Clinical finding (finding)).","StructureDefinition/radiological-diagnostic-report","SCT"
http://hl7.org/fhir/ValueSet/common-tags,4.0.1,draft,"2.16.840.1.113883.4.642.3.79",CommonTags,Common Tags,"Common Tag Codes defined by FHIR project","StructureDefinition/probandin,StructureDefinition/medication-statement,StructureDefinition/medication-administration","THO"
http://hl7.org/fhir/ValueSet/condition-category,4.0.1,draft,"2.16.840.1.113883.4.642.3.162",ConditionCategoryCodes,Condition Category Codes,"Preferred value set for Condition Categories.","StructureDefinition/tumor-disorder","THO"
http://hl7.org/fhir/ValueSet/condition-clinical,4.0.1,draft,"2.16.840.1.113883.4.642.3.164",ConditionClinicalStatusCodes,Condition Clinical Status Codes,"Preferred value set for Condition Clinical Status.","StructureDefinition/tumor-disorder","THO"
http://hl7.org/fhir/ValueSet/condition-code,4.0.1,draft,"2.16.840.1.113883.4.642.3.161",Condition/Problem/DiagnosisCodes,Condition/Problem/Diagnosis Codes,"Example value set for Condition/Problem/Diagnosis codes.","StructureDefinition/medication-statement,StructureDefinition/tumor-disorder,StructureDefinition/radiological-tnm-read-procedure,StructureDefinition/clinical-study,StructureDefinition/radiological-read-procedure,StructureDefinition/radiological-recist-read-procedure","SCT"
http://hl7.org/fhir/ValueSet/condition-severity,4.0.1,draft,"2.16.840.1.113883.4.642.3.168",Condition/DiagnosisSeverity,Condition/Diagnosis Severity,"Preferred value set for Condition/Diagnosis severity grading.","StructureDefinition/tumor-disorder","SCT"
http://hl7.org/fhir/ValueSet/condition-stage,4.0.1,draft,"2.16.840.1.113883.4.642.3.170",ConditionStage,Condition Stage,"Example value set for stages of cancer and other conditions.","StructureDefinition/tumor-disorder","SCT"
http://hl7.org/fhir/ValueSet/condition-stage-type,4.0.1,draft,"2.16.840.1.113883.4.642.3.171",ConditionStageType,Condition Stage Type,"Example value set for the type of stages of cancer and other conditions","StructureDefinition/tumor-disorder","SCT"
http://hl7.org/fhir/ValueSet/condition-ver-status,4.0.1,draft,"2.16.840.1.113883.4.642.3.166",ConditionVerificationStatus,ConditionVerificationStatus,"The verification status to support or decline the clinical status of the condition or diagnosis.","StructureDefinition/tumor-disorder","THO"
http://hl7.org/fhir/ValueSet/data-absent-reason,4.0.1,active,"2.16.840.1.113883.4.642.3.5",DataAbsentReason,DataAbsentReason,"Used to specify why the normally expected content of the data element is missing.","StructureDefinition/karnofsky-performance-status,StructureDefinition/recist-category-observation,StructureDefinition/histology-topography,StructureDefinition/uicc-tnm,StructureDefinition/body-weight,StructureDefinition/recist-assessment-response,StructureDefinition/tumor-measurement,StructureDefinition/histopathological-grading-who,StructureDefinition/tnm-category-observation,StructureDefinition/ecog-performance-status,StructureDefinition/body-height,StructureDefinition/uicc-tnm-r-classification,StructureDefinition/vital-signs-base","THO"
http://hl7.org/fhir/ValueSet/days-of-week,4.0.1,active,"2.16.840.1.113883.4.642.3.512",DaysOfWeek,DaysOfWeek,"The days of the week.","StructureDefinition/medication-statement","hl7.fhir.r4.core"
http://hl7.org/fhir/ValueSet/device-action,4.0.1,draft,"2.16.840.1.113883.4.642.3.425",ProcedureDeviceActionCodes,Procedure Device Action Codes,"Example codes indicating the change that happened to the device during the procedure.  Note that these are in no way complete and might not even be appropriate for some uses.","StructureDefinition/radiological-tnm-read-procedure,StructureDefinition/radiological-read-procedure,StructureDefinition/radiological-recist-read-procedure","SCT"
http://hl7.org/fhir/ValueSet/device-kind,4.0.1,draft,"2.16.840.1.113883.4.642.3.208",FHIRDeviceTypes,FHIR Device Types,"Codes used to identify medical devices. Includes concepts from SNOMED CT (http://www.snomed.org/) where concept is-a 49062001 (Device)  and is provided as a suggestive example.","StructureDefinition/radiological-tnm-read-procedure,StructureDefinition/radiological-read-procedure,StructureDefinition/radiological-recist-read-procedure","SCT"
http://hl7.org/fhir/ValueSet/diagnostic-report-status,4.0.1,draft,"2.16.840.1.113883.4.642.3.235",DiagnosticReportStatus,DiagnosticReportStatus,"The status of the diagnostic report.","StructureDefinition/radiological-diagnostic-report","hl7.fhir.r4.core"
http://hl7.org/fhir/ValueSet/diagnostic-service-sections,4.0.1,draft,"2.16.840.1.113883.4.642.3.234",DiagnosticServiceSectionCodes,Diagnostic Service Section Codes,"This value set includes all the codes in HL7 V2 table 0074.","StructureDefinition/radiological-diagnostic-report","THO (V2)"
http://hl7.org/fhir/ValueSet/dose-rate-type,4.0.1,draft,"2.16.840.1.113883.4.642.3.981",DoseAndRateType,DoseAndRateType,"The kind of dose or rate specified.","StructureDefinition/medication-statement","THO"
http://hl7.org/fhir/ValueSet/duration-units,4.0.1,active,"2.16.840.1.113883.4.642.3.61",CommonUCUMCodesForDuration,Common UCUM Codes for Duration,"Unified Code for Units of Measure (UCUM). This value set includes all UCUM codes","StructureDefinition/tumor-specimen","UCUM"
http://hl7.org/fhir/ValueSet/event-status,4.0.1,draft,"2.16.840.1.113883.4.642.3.109",EventStatus,EventStatus,"Codes identifying the lifecycle stage of an event.","StructureDefinition/radiological-tnm-read-procedure,StructureDefinition/radiological-read-procedure,StructureDefinition/radiological-recist-read-procedure","hl7.fhir.r4.core"
http://hl7.org/fhir/ValueSet/event-timing,4.0.1,active,"2.16.840.1.113883.4.642.3.75",EventTiming,EventTiming,"Real world event relating to the schedule.","StructureDefinition/medication-statement","THO (V3),hl7.fhir.r4.core"
http://hl7.org/fhir/ValueSet/identifier-type,4.0.1,active,"2.16.840.1.113883.4.642.3.45",Identifier Type Codes,IdentifierType,"A coded type for an identifier that can be used to determine which identifier to use for a specific purpose.","StructureDefinition/body-structure-base,StructureDefinition/probandin,StructureDefinition/tumor,StructureDefinition/clinical-study","THO (V2)"
http://hl7.org/fhir/ValueSet/identifier-use,4.0.1,active,"2.16.840.1.113883.4.642.3.57",IdentifierUse,IdentifierUse,"Identifies the purpose for this identifier, if known .","StructureDefinition/body-structure-base,StructureDefinition/probandin,StructureDefinition/tumor,StructureDefinition/clinical-study","hl7.fhir.r4.core"
http://hl7.org/fhir/ValueSet/jurisdiction,4.0.1,active,"2.16.840.1.113883.4.642.3.48",Jurisdiction ValueSet,Jurisdiction,"This value set defines a base set of codes for country, country subdivision and region    for indicating where a resource is intended to be used.             Note: The codes for countries and country subdivisions are taken from    [ISO 3166](https://www.iso.org/iso-3166-country-codes.html)    while the codes for ""supra-national"" regions are from    [UN Standard country or area codes for statistical use (M49)](http://unstats.un.org/unsd/methods/m49/m49.htm).","StructureDefinition/clinical-study","hl7.terminology.r4,Other"
http://hl7.org/fhir/ValueSet/languages,4.0.1,draft,"2.16.840.1.113883.4.642.3.20",CommonLanguages,Common Languages,"This value set includes common codes from BCP-47 (http://tools.ietf.org/html/bcp47)","StructureDefinition/body-structure-base,StructureDefinition/probandin,StructureDefinition/recist-category-observation,StructureDefinition/histology-topography,StructureDefinition/tumor,StructureDefinition/radiological-read-procedure,StructureDefinition/tumor-measurement,StructureDefinition/tnm-category-observation,StructureDefinition/ecog-performance-status,StructureDefinition/body-height,StructureDefinition/uicc-tnm-r-classification,StructureDefinition/radiological-diagnostic-report,StructureDefinition/clinical-study,StructureDefinition/medication-administration,StructureDefinition/medication-statement,StructureDefinition/karnofsky-performance-status,StructureDefinition/uicc-tnm,StructureDefinition/body-weight,StructureDefinition/recist-assessment-response,StructureDefinition/histopathological-grading-who,StructureDefinition/tumor-specimen,StructureDefinition/radiological-tnm-read-procedure,StructureDefinition/tumor-disorder,StructureDefinition/vital-signs-base,StructureDefinition/radiological-recist-read-procedure","hl7.terminology.r4"
http://hl7.org/fhir/ValueSet/manifestation-or-symptom,4.0.1,draft,"2.16.840.1.113883.4.642.3.169",ManifestationAndSymptomCodes,Manifestation and Symptom Codes,"Example value set for Manifestation and Symptom codes.","StructureDefinition/tumor-disorder","SCT"
http://hl7.org/fhir/ValueSet/med-admin-perform-function,4.0.1,draft,"2.16.840.1.113883.4.642.3.349",MedicationAdministration Performer Function Codes,Medication administration  performer  function  codes,"MedicationAdministration Performer Function Codes","StructureDefinition/medication-administration","THO"
http://hl7.org/fhir/ValueSet/medication-admin-category,4.0.1,draft,"2.16.840.1.113883.4.642.3.347",MedicationAdministration Category Codes,Medication administration  category  codes,"MedicationAdministration Category Codes","StructureDefinition/medication-administration","THO"
http://hl7.org/fhir/ValueSet/medication-admin-status,4.0.1,draft,"2.16.840.1.113883.4.642.3.340",MedicationAdministration Status Codes,Medication administration  status  codes,"MedicationAdministration Status Codes","StructureDefinition/medication-administration","THO"
http://hl7.org/fhir/ValueSet/medication-as-needed-reason,4.0.1,draft,"2.16.840.1.113883.4.642.3.96",SNOMEDCTMedicationAsNeededReasonCodes,SNOMED CT Medication As Needed Reason Codes,"This value set includes all clinical findings from SNOMED CT - provided as an exemplar value set.","StructureDefinition/medication-statement","SCT"
http://hl7.org/fhir/ValueSet/medication-codes,4.0.1,draft,"2.16.840.1.113883.4.642.3.375",SNOMEDCTMedicationCodes,SNOMED CT Medication Codes,"This value set includes all drug or medicament substance codes and all pharmaceutical/biologic products from SNOMED CT - provided as an exemplar value set.","StructureDefinition/medication-statement,StructureDefinition/medication-administration","SCT"
http://hl7.org/fhir/ValueSet/medication-statement-category,4.0.1,draft,"2.16.840.1.113883.4.642.3.370",Medication usage category codes,Medication usage category codes,"Medication Status Codes","StructureDefinition/medication-statement","THO"
http://hl7.org/fhir/ValueSet/medication-statement-status,4.0.1,draft,"2.16.840.1.113883.4.642.3.367",Medication Status Codes,Medication  status  codes,"Medication Status Codes","StructureDefinition/medication-statement","hl7.fhir.r4.core"
http://hl7.org/fhir/ValueSet/observation-category,4.0.1,draft,"2.16.840.1.113883.4.642.3.403",ObservationCategoryCodes,Observation Category Codes,"Observation Category codes.","StructureDefinition/karnofsky-performance-status,StructureDefinition/recist-category-observation,StructureDefinition/histology-topography,StructureDefinition/uicc-tnm,StructureDefinition/body-weight,StructureDefinition/recist-assessment-response,StructureDefinition/tumor-measurement,StructureDefinition/histopathological-grading-who,StructureDefinition/tnm-category-observation,StructureDefinition/ecog-performance-status,StructureDefinition/body-height,StructureDefinition/uicc-tnm-r-classification,StructureDefinition/vital-signs-base","THO"
http://hl7.org/fhir/ValueSet/observation-codes,4.0.1,draft,"2.16.840.1.113883.4.642.3.396",LOINCCodes,LOINC Codes,"This value set includes all LOINC codes","StructureDefinition/karnofsky-performance-status,StructureDefinition/recist-category-observation,StructureDefinition/histology-topography,StructureDefinition/uicc-tnm,StructureDefinition/body-weight,StructureDefinition/recist-assessment-response,StructureDefinition/tumor-measurement,StructureDefinition/histopathological-grading-who,StructureDefinition/tnm-category-observation,StructureDefinition/ecog-performance-status,StructureDefinition/body-height,StructureDefinition/uicc-tnm-r-classification,StructureDefinition/vital-signs-base","LOINC"
http://hl7.org/fhir/ValueSet/observation-interpretation,4.0.1,active,"2.16.840.1.113883.4.642.3.399",ObservationInterpretationCodes,Observation Interpretation Codes,"A categorical assessment, providing a rough qualitative interpretation of the observation value,    such as “normal”/ “abnormal”,”low” / “high”, “better” / “worse”, “susceptible” / “resistant”, “expected”/ “not expected”.    The value set is intended to be for ANY use where coded representation of an interpretation is needed.             Notes:          This is being communicated in v2.x in OBX-8 (Observation Interpretation), in v3 in ObservationInterpretation (CWE) in R1 (Representative Realm) and in FHIR in    Observation.interpretation. Historically these values come from the laboratory domain, and these codes are extensively    used. The value set binding is extensible, so codes outside the value set that are needed for interpretation concepts    (i.e. particular meanings) that are not included in the value set can be used, and these new codes may also be added to    the value set and published in a future version.","StructureDefinition/karnofsky-performance-status,StructureDefinition/recist-category-observation,StructureDefinition/histology-topography,StructureDefinition/uicc-tnm,StructureDefinition/body-weight,StructureDefinition/recist-assessment-response,StructureDefinition/tumor-measurement,StructureDefinition/histopathological-grading-who,StructureDefinition/tnm-category-observation,StructureDefinition/ecog-performance-status,StructureDefinition/body-height,StructureDefinition/uicc-tnm-r-classification,StructureDefinition/vital-signs-base","THO (V3)"
http://hl7.org/fhir/ValueSet/observation-methods,4.0.1,draft,"2.16.840.1.113883.4.642.3.395",ObservationMethods,Observation Methods,"Observation Method codes from [SNOMED CT](http://snomed.info/sct) where concept is-a 272394005 (Technique (qualifier value)) or is-a 129264002 (Action (qualifier value)) or is-a 386053000 (Evaluation procedure(procedure))","StructureDefinition/tnm-category-observation,StructureDefinition/karnofsky-performance-status,StructureDefinition/recist-category-observation,StructureDefinition/ecog-performance-status,StructureDefinition/histology-topography,StructureDefinition/body-height,StructureDefinition/uicc-tnm-r-classification,StructureDefinition/uicc-tnm,StructureDefinition/body-weight,StructureDefinition/vital-signs-base,StructureDefinition/recist-assessment-response,StructureDefinition/histopathological-grading-who","SCT"
http://hl7.org/fhir/ValueSet/observation-status,4.0.1,active,"2.16.840.1.113883.4.642.3.400",ObservationStatus,ObservationStatus,"Codes providing the status of an observation.","StructureDefinition/karnofsky-performance-status,StructureDefinition/recist-category-observation,StructureDefinition/histology-topography,StructureDefinition/uicc-tnm,StructureDefinition/body-weight,StructureDefinition/recist-assessment-response,StructureDefinition/tumor-measurement,StructureDefinition/histopathological-grading-who,StructureDefinition/tnm-category-observation,StructureDefinition/ecog-performance-status,StructureDefinition/body-height,StructureDefinition/uicc-tnm-r-classification,StructureDefinition/vital-signs-base","hl7.fhir.r4.core"
http://hl7.org/fhir/ValueSet/performer-role,4.0.1,draft,"2.16.840.1.113883.4.642.3.433",ProcedurePerformerRoleCodes,Procedure Performer Role Codes,"This example value set defines the set of codes that can be used to indicate a role of a procedure performer.","StructureDefinition/radiological-tnm-read-procedure,StructureDefinition/radiological-read-procedure,StructureDefinition/radiological-recist-read-procedure","SCT"
http://hl7.org/fhir/ValueSet/procedure-category,4.0.1,draft,"2.16.840.1.113883.4.642.3.430",ProcedureCategoryCodes(SNOMEDCT),Procedure Category Codes (SNOMED CT),"Procedure Category code: A selection of relevant SNOMED CT codes.","StructureDefinition/radiological-tnm-read-procedure,StructureDefinition/radiological-read-procedure,StructureDefinition/radiological-recist-read-procedure","SCT"
http://hl7.org/fhir/ValueSet/procedure-code,4.0.1,draft,"2.16.840.1.113883.4.642.3.427",ProcedureCodes(SNOMEDCT),Procedure Codes (SNOMED CT),"Procedure Code: All SNOMED CT procedure codes.","StructureDefinition/radiological-read-procedure","SCT"
http://hl7.org/fhir/ValueSet/procedure-followup,4.0.1,draft,"2.16.840.1.113883.4.642.3.429",ProcedureFollowUpCodes(SNOMEDCT),Procedure Follow up Codes (SNOMED CT),"Procedure follow up codes: A selection of SNOMED CT codes relevant to procedure follow up.","StructureDefinition/radiological-tnm-read-procedure,StructureDefinition/radiological-read-procedure,StructureDefinition/radiological-recist-read-procedure","SCT"
http://hl7.org/fhir/ValueSet/procedure-not-performed-reason,4.0.1,active,"2.16.840.1.113883.4.642.3.431",ProcedureNotPerformedReason(SNOMED-CT),Procedure Not Performed Reason (SNOMED-CT),"Situation codes describing the reason that a procedure, which might otherwise be expected, was not performed, or a procedure that was started and was not completed. Consists of SNOMED CT codes, children of procedure contraindicated (183932001), procedure discontinued (416406003), procedure not done (416237000), procedure not indicated (428119001), procedure not offered (416064006), procedure not wanted (416432009), procedure refused (183944003), and procedure stopped (394908001).","StructureDefinition/radiological-tnm-read-procedure,StructureDefinition/radiological-read-procedure,StructureDefinition/radiological-recist-read-procedure","SCT"
http://hl7.org/fhir/ValueSet/procedure-outcome,4.0.1,draft,"2.16.840.1.113883.4.642.3.428",ProcedureOutcomeCodes(SNOMEDCT),Procedure Outcome Codes (SNOMED CT),"Procedure Outcome code: A selection of relevant SNOMED CT codes.","StructureDefinition/radiological-tnm-read-procedure,StructureDefinition/radiological-read-procedure,StructureDefinition/radiological-recist-read-procedure","SCT"
http://hl7.org/fhir/ValueSet/procedure-reason,4.0.1,draft,"2.16.840.1.113883.4.642.3.432",ProcedureReasonCodes,Procedure Reason Codes,"This example value set defines the set of codes that can be used to indicate a reason for a procedure.","StructureDefinition/radiological-tnm-read-procedure,StructureDefinition/radiological-read-procedure,StructureDefinition/radiological-recist-read-procedure","SCT"
http://hl7.org/fhir/ValueSet/quantity-comparator,4.0.1,active,"2.16.840.1.113883.4.642.3.59",QuantityComparator,QuantityComparator,"How the Quantity should be understood and represented.","StructureDefinition/medication-statement,StructureDefinition/body-height,StructureDefinition/uicc-tnm,StructureDefinition/medication-administration,StructureDefinition/body-weight","hl7.fhir.r4.core"
http://hl7.org/fhir/ValueSet/reason-medication-given-codes,4.0.1,draft,"2.16.840.1.113883.4.642.3.344",ReasonMedicationGivenCodes,Reason Medication Given Codes,"This value set is provided as an example. The value set to instantiate this attribute should be drawn from a robust terminology code system that consists of or contains concepts to support the medication process.","StructureDefinition/medication-administration","THO"
http://hl7.org/fhir/ValueSet/reason-medication-not-given-codes,4.0.1,draft,"2.16.840.1.113883.4.642.3.342",SNOMEDCTReasonMedicationNotGivenCodes,SNOMED CT Reason Medication Not Given Codes,"This value set includes all medication refused, medication not administered, and non-administration of necessary drug or medicine codes from SNOMED CT - provided as an exemplar value set.","StructureDefinition/medication-administration","SCT"
http://hl7.org/fhir/ValueSet/reason-medication-status-codes,4.0.1,draft,"2.16.840.1.113883.4.642.3.369",SNOMEDCTDrugTherapyStatusCodes,SNOMED CT Drug Therapy Status codes ,"This value set includes some taken and not taken reason codes from SNOMED CT - provided as an exemplar","StructureDefinition/medication-statement","SCT"
http://hl7.org/fhir/ValueSet/referencerange-appliesto,4.0.1,draft,"2.16.840.1.113883.4.642.3.407",ObservationReferenceRangeAppliesToCodes,Observation Reference Range Applies To Codes,"This value set defines a set of codes that can be used to indicate the particular target population the reference range applies to.","StructureDefinition/karnofsky-performance-status,StructureDefinition/recist-category-observation,StructureDefinition/histology-topography,StructureDefinition/uicc-tnm,StructureDefinition/body-weight,StructureDefinition/recist-assessment-response,StructureDefinition/tumor-measurement,StructureDefinition/histopathological-grading-who,StructureDefinition/tnm-category-observation,StructureDefinition/ecog-performance-status,StructureDefinition/body-height,StructureDefinition/uicc-tnm-r-classification,StructureDefinition/vital-signs-base","SCT"
